{
  "$schema": "http://json-schema.org/draft-07/schema#",
  "type": "object",
  "title": "User Schema",
  "description": "Schema for user test data validation",
  "properties": {
    "id": {
      "type": "string",
      "description": "Unique user identifier"
    },
    "firstName": {
      "type": "string",
      "minLength": 1,
      "maxLength": 50,
      "description": "User's first name"
    },
    "lastName": {
      "type": "string",
      "minLength": 1,
      "maxLength": 50,
      "description": "User's last name"
    },
    "email": {
      "type": "string",
      "format": "email",
      "description": "User's email address"
    },
    "username": {
      "type": "string",
      "minLength": 3,
      "maxLength": 30,
      "pattern": "^[a-zA-Z0-9_]+$",
      "description": "User's username"
    },
    "password": {
      "type": "string",
      "minLength": 8,
      "description": "User's password"
    },
    "phoneNumber": {
      "type": "string",
      "pattern": "^\\+?[1-9]\\d{1,14}$",
      "description": "User's phone number"
    },
    "dateOfBirth": {
      "type": "string",
      "format": "date",
      "description": "User's date of birth in YYYY-MM-DD format"
    },
    "role": {
      "type": "string",
      "enum": ["user", "admin", "moderator"],
      "description": "User's role in the system"
    }
  },
  "required": ["id", "firstName", "lastName", "email", "username", "password"],
  "additionalProperties": false
}